{
  "schema_version": "1.0",
  "id": "tic-158712138-s01",
  "version": "0.1.0",
  "title": "TIC 158712138: a provisional 2.69721019-day signal",
  "target": {
    "tic": "158712138",
    "gaia_dr3": null,
    "aliases": [
      "TIC 158712138"
    ],
    "coordinates": {
      "ra_deg": 165.12356345,
      "dec_deg": -37.013815993,
      "frame": "ICRS",
      "epoch": "J2000",
      "provenance": "Saved TIC discovery coordinates; aperture target identity, not a verified eclipsed host."
    }
  },
  "signal": {
    "period_d": {
      "value": 2.6972101894267446,
      "error": 8.012514834204294e-06
    },
    "epoch_btjd": {
      "value": 1545.3690895629115,
      "error": 0.005855421691224179
    },
    "epoch_bjd_tdb": 2458545.369089563,
    "bjd_offset": 2457000,
    "time_scale": "TDB",
    "covariance_epoch_period_d2": [
      [
        3.428596318205863e-05,
        -4.450260807524321e-08
      ],
      [
        -4.4502608075243074e-08,
        6.420039396834387e-11
      ]
    ],
    "covariance_method": "Saved local integrated-trapezoid diagnostic Jacobian covariance; conditional and not empirically calibrated.",
    "duration_h": {
      "value": 2.6977950982056362,
      "error": null
    },
    "depth_ppm": {
      "value": 2341.5957995504677,
      "error": 157.6805640209874
    },
    "model": "Exposure-integrated diagnostic trapezoid; free event depths and local baseline. Separate linear-baseline box-window aggregate depth.",
    "sectors": [
      36,
      90
    ],
    "covered_events": 16,
    "limits": [
      "Preliminary unclassified signal; binary, blend and instrumental explanations remain open.",
      "Conditional diagnostic errors; no calibrated false-alarm or planet probability.",
      "Duration uncertainty unavailable; null is intentional.",
      "Mission clock, host identity, noise coverage and search selection remain unresolved.",
      "All saved event exclusions, failed fits and signed alternative diagnostics are retained."
    ]
  },
  "assessment": {
    "disposition": "unclassified_transit_like_signal",
    "source_localisation": {
      "status": "unresolved",
      "reason": "No calibrated physical-host attribution; FITS target identity identifies the aperture only.",
      "evidence": [
        "inputs.json"
      ]
    },
    "timing_consistency": {
      "status": "unresolved",
      "reason": "Signed event profiles retain failures, competing clock/shape hypotheses and conditional errors; independent clock/coverage calibration unfinished.",
      "evidence": [
        "evidence/timing-summary.json",
        "evidence/timing-events.json"
      ]
    }
  },
  "novelty": {
    "status": "no_match_in_checked_sources",
    "checked_utc": "2026-10-11T08:40:37.202984+00:00",
    "evidence": [
      "evidence/catalogue-check.json",
      "evidence/direct-catalogue-hypotheses.json",
      "NOVELTY.md"
    ],
    "limits": [
      "No match in listed snapshots, not established discovery priority.",
      "Unindexed literature and catalogue completeness remain unresolved.",
      "Coordinates are static; nearby-source exclusion and proper-motion reconciliation remain incomplete."
    ]
  },
  "provenance": {
    "analysis_date": "2026-10-11",
    "source_revisions": {
      "inputs": "3c214981ab79e9a570e25faf5de98448ba6f10b0",
      "ephemeris": "3c214981ab79e9a570e25faf5de98448ba6f10b0",
      "photometry": "3c214981ab79e9a570e25faf5de98448ba6f10b0",
      "robustness": "3c214981ab79e9a570e25faf5de98448ba6f10b0",
      "timing-summary": "094208e8e96ead0b95dce7832fd86d22845864f0",
      "timing-events": "094208e8e96ead0b95dce7832fd86d22845864f0",
      "timing-controls": "094208e8e96ead0b95dce7832fd86d22845864f0",
      "alternative-summary": "871aad6a9f2f0cb4989dd8f7e0f42d6922e802b4"
    },
    "runs": {
      "inputs": "20261011T011224Z-vet-acquisition-da93b3",
      "ephemeris": "20261011T011225Z-vet-photometry-147467",
      "photometry": "20261011T011225Z-vet-photometry-147467",
      "robustness": "20261011T011227Z-vet-robustness-466e36",
      "timing-summary": "20261011T055331Z-vet-timing-590662",
      "timing-events": "20261011T055331Z-vet-timing-590662",
      "timing-controls": "20261011T055331Z-vet-timing-590662",
      "alternative-summary": "20261011T062532Z-vet-alternatives-ada04c"
    },
    "input_lock": "inputs.json"
  },
  "reproducibility": {
    "level": "evidence_inspection",
    "command": "uv sync --frozen && uv run python scripts/catalogue.py check",
    "limits": [
      "Saved scientific evidence and hashes can be inspected; this does not rerun numerical fits.",
      "Exact FITS bytes, complete analysis code/environment and public numerical capsule are not bundled."
    ],
    "requirements_for_numerical_release": [
      "Provide exact inputs, selected source, frozen environment and a verified clean public-input rerun."
    ]
  },
  "publication": {
    "state": "draft",
    "first_public_utc": null,
    "release_url": null,
    "doi": null,
    "authors": [
      "Bruno Rahle"
    ]
  },
  "evidence": [
    "inputs.json",
    "analysis-settings.json",
    "README.md",
    "NOVELTY.md",
    "REPRODUCIBILITY.md",
    "evidence/alternative-summary.json",
    "evidence/ephemeris.json",
    "evidence/inputs.json",
    "evidence/photometry.json",
    "evidence/robustness.json",
    "evidence/timing-controls.json",
    "evidence/timing-events.json",
    "evidence/timing-summary.json",
    "evidence/catalogue-check.json",
    "evidence/direct-catalogue-hypotheses.json",
    "evidence/event-depths.png"
  ],
  "history": [
    {
      "date": "2026-10-11",
      "version": "0.1.0",
      "change": "Initial evidence-inspection dossier from the reusable batch; all scientific classifications remain provisional."
    }
  ]
}
